{
  "source": "example-string",
  "format": "opencypher",
  "iamRoleArn": "arn:aws:neptune:us-east-1:123456789012:cluster:neptune-1",
  "region": "us-east-1",
  "mode": "RESUME",
  "failOnError": "FALSE",
  "parallelism": "MEDIUM",
  "parserConfiguration": {
    "baseUri": "example-string",
    "namedGraphUri": "my-neptune-cluster",
    "allowEmptyStrings": false
  },
  "updateSingleCardinalityProperties": "TRUE",
  "queueRequest": "TRUE",
  "dependencies": [
    "example-string"
  ],
  "userProvidedEdgeIds": "TRUE"
}